review_id,sentence_id,Time,sentence_type,sentence
48,10370,2017-02-03 00:00:00,q,"of randstad}. After clearing these, they will schedule a written test and an interview with the team leads of Google {different departments}. Most of the interview will be to test your communication skills."
48,10371,2017-02-03 00:00:00,q,I got selected for Google + and the pay was around 16 to 20k.{ Food(buffet with around 25–30 items) and transport will be provided by the company} The work was quite interesting but i resigned with in 4 months as i got selected for a PSB.
48,10372,2017-02-03 00:00:00,q,"P.S : if you are looking for a programmer kind of job at Google, I don't have any idea.!"
50,10373,2017-02-09 00:00:00,q,Once Restore Your browser Udate your browser Otherwise uninstall browser nd install again.
50,10374,2017-02-09 00:00:00,q,There was missing certificate that's it or crashed.
50,10375,2017-02-09 00:00:00,q,So update ya restore.
50,10376,2017-02-09 00:00:00,q,Once scan windows defendare anti theft firewall.
2,10377,2017-02-15 00:00:00,q,Things which appear on search engine are due to number of hits and most number of times searched.
2,10378,2017-02-15 00:00:00,q,As people have searched PM of INDIA more number of times any phrase associated with it will show mostly the same results.
2,10379,2017-02-15 00:00:00,q,Try searching “Most enthusiastic Prime minister of the world” “most hardworking Prime minister of the world” I hope you will understand that Google is something which we have created and results are also the outcome of our input to it.
2,10380,2017-02-15 00:00:00,q,It is not the mastermind.
2,10381,2017-02-15 00:00:00,q,We should not trust the results on Google for personalities.
2,10382,2017-02-15 00:00:00,q,"Same goes for other politicians also they are not what they are projected on the Google or any search engine for that matter as it is just the compilation of news, blogs on social media."
2,10383,2017-02-15 00:00:00,q,"They have reached that position is itself an indicator of their ability, dedication and hardship."
2,10384,2017-02-15 00:00:00,q,They should be respected.
3,10385,2017-02-15 00:00:00,q,Google search works on key words.
3,10386,2017-02-15 00:00:00,q,For example if you type “stupid” in Google search you will see all photos hash tagged with this word.
3,10387,2017-02-15 00:00:00,q,You can see Jackie Chan in first photo because someone hash tagged (leveled) his photo as stupid.
3,10388,2017-02-15 00:00:00,q,"If you type “hot”, you will see all bold photos of models, actresses."
3,10389,2017-02-15 00:00:00,q,"Actually hot word also defines the taste of chili paper, heated iron etc."
3,10390,2017-02-15 00:00:00,q,"But what do you see? Only hot bold girls, just because of popularity & defined, associated as key word with such photos."
3,10391,2017-02-15 00:00:00,q,We can say about search result of “most stupid prime minister of India” that oppositions hash tagged this word with Narendra Modi's photos as much as possible.
3,10392,2017-02-15 00:00:00,q,If you hash tag “smart” word as much as possible to his photos then google will show you his same photos as smart.
3,10393,2017-02-15 00:00:00,q,It's magic of key word search.
4,10394,2017-02-15 00:00:00,q,You want the correct answer or the one that can please you? I think I will give you the correct answer.
4,10395,2017-02-15 00:00:00,q,"Google search is all statistics, weight, relative weight of words and phrases."
4,10396,2017-02-15 00:00:00,q,"To humans, who is most stupid is open to contention."
4,10397,2017-02-15 00:00:00,q,"For Google, most important words/phrase in the given query is Prime minister of India, thus it shows Narendra Modi’s image."
5,10398,2017-02-15 00:00:00,q,The reason behind this search result is the search algorithm used in Google.
5,10399,2017-02-15 00:00:00,q,"It works with key words and the words closely related to it, it also factors the location you are in and your previous searches as well."
5,10400,2017-02-15 00:00:00,q,So in this case the search words are Most stupid Prime Minister of India/ World.
5,10401,2017-02-15 00:00:00,q,"The word Stupid is co-related to Prime Minister Modi by the article titled in Reuters ‘  Why work with India’s new leader? It’s the economy, stupid  And the rest of the perfectly match with PM Modi . Thus we see PM Modi in the results."
5,10402,2017-02-15 00:00:00,q,He was even featured in Google’s query result of  Top 10 criminals of India.
5,10403,2017-02-15 00:00:00,q, They did apologise for it but it was all due to search algorithms.
5,10404,2017-02-15 00:00:00,q,(It has nothing to do with him or his Deeds)
6,10405,2017-02-15 00:00:00,q,"This has something to do with Algo (Algorithm) Search engine…It means that what u type in the search engine (Google) it shows u the result…Now try searching “Rahul is an Idiot r Sonia is corrupt” surprisingly ull get more of QUORA searches and YOUTUBE videos…Pretty sure this is how it works…BTW, We have got this amazing, hardworking and a dedicated PM Mr.Modi and if ppl can't see it now they'll definitely will in the coming days…?"
7,10406,2017-02-15 00:00:00,q,Google is not god.
9,10407,2017-02-15 00:00:00,q,Change location settings for google and you will receive a different result.
87,10408,2017-02-15 00:00:00,q,If you are still a student and you are looking for an entry level role then you have two options : APAC Tests  which starts in August each year.
87,10409,2017-02-15 00:00:00,q,You must be a final year student and joining date is around July of next year.
87,10410,2017-02-15 00:00:00,q,Referral by an internal employee can be filed as the position is open.
87,10411,2017-02-15 00:00:00,q,Position for July joining closes in January month of same year.
87,10412,2017-02-15 00:00:00,q,If you are not a fresher then the position is usually open for most part of the year.
87,10413,2017-02-15 00:00:00,q,And new batches join very frequently (once every two months probably).
1,10414,2017-02-16 00:00:00,q,"To know why Google shows our P.M Modi's image for the queries like “World's top 10 criminals”, one should know about SEO(Search Engine Optimization) and how Google's page rank algorithm works."
1,10415,2017-02-16 00:00:00,q,SEO: Consider SEO as something like names of children which teachers use to search a student in a class.
1,10416,2017-02-16 00:00:00,q,SEO is achieved using <meta> tag embedded into a web page (HTML document). Meta tags consists of keywords and description which would have queries SEO analyst thinks that search engine users might search.
1,10417,2017-02-16 00:00:00,q,"For example, say you have an article in your website that describes about ISRO's satellite launch, the keywords would be , “ISRO”, “ISRO satellite launch”, “ISRO Mangalyan”, etc."
1,10418,2017-02-16 00:00:00,q,Google usually use these keywords to put your website's link on Google's search results.
1,10419,2017-02-16 00:00:00,q,Page rank algorithm: Consider page rank algorithm as grades of students in a class.
1,10420,2017-02-16 00:00:00,q,"But, here students are replaced with websites."
1,10421,2017-02-16 00:00:00,q,Google rank websites according to the traffic they get (views or clicks) for the respective search query.
1,10422,2017-02-16 00:00:00,q,"For example, if you search “quora”, quora's site link will be the top result, because for that query, loads of people would've clicked that link that other links."
1,10423,2017-02-16 00:00:00,q,"So, it places each link on it's search result according to the rank."
1,10424,2017-02-16 00:00:00,q,"Conclusion: Some morons made bunch of dumb articles with meta tag keywords like “world's top ten criminals”, “most stupid prime Minister”, etc."
1,10425,2017-02-16 00:00:00,q,"Unfortunately, many people clicked those links and made them top of the results."
1,10426,2017-02-16 00:00:00,q,Ps.
1,10427,2017-02-16 00:00:00,q,Google isn't responsible for these search results since they do not show them purposefully.
1,10428,2017-02-16 00:00:00,q,For your reference: Search engine optimization - Wikipedia PageRank - Wikipedia
86,10429,2017-02-17 00:00:00,q,A website is a certificate of your services.
86,10430,2017-02-17 00:00:00,q,"Digital presence provides you credibility in the eyes of people, as in today’s time people mostly rely on internet for their searches.Our web designers ensure most suitable digital experience for the clients."
86,10431,2017-02-17 00:00:00,q,"In  website development  all the major and minor element is taken care of such that website is easily accessible to all from various devices such mobiles, Tablets or Laptops, in minimum possible load time."
86,10432,2017-02-17 00:00:00,q,The information structure is well planned and the content is formatted so it is easy to scan.
8,10433,2017-02-18 00:00:00,q,It is fake … whenever a person should reaches newer heights … people starts doing wrong wrong comments about that person…
45,10434,2017-02-19 00:00:00,q,Friend I think after two years working in Google you have many better options for higher studies.
45,10435,2017-02-19 00:00:00,q,You can pursue your interest from better abroad institutions than IIT.
45,10436,2017-02-19 00:00:00,q,I am not saying that IITs are not good but you should always choose best option.
45,10437,2017-02-19 00:00:00,q,I must say that higher qualification and industrial experience will give you benefit.
46,10438,2017-02-19 00:00:00,q,"What are you seeking for I mean are you interested in research , do you wish to improve your skills or you wanna change your job profile . Considering all these factor we can come to a conclusion."
46,10439,2017-02-19 00:00:00,q,What is your educational background i.e from institue you have done graduation? If you were from an private institution or state level college then definetlyyou have missed a lot which an IITian go through.
46,10440,2017-02-19 00:00:00,q,"Rigorous academic shedule of IIT , top notch facilities for research , foreign exchange program , internship in leading organisations, rich culture of campus , healthy atmosphere among students , zeal of learning new things for that clubs , societies helps candidate proffesionally."
46,10441,2017-02-19 00:00:00,q,"world class sports facility, extra curicullar activities , career oriented trainings , fun activities , cultural clubs ,well associated commities and transparent working of SENATE and each body of instiute."
46,10442,2017-02-19 00:00:00,q,"NO other organisation in INDIA will have such system , where a person can improve skills and learn a lot with freedom."
46,10443,2017-02-19 00:00:00,q,IIT’s are the undoubtedly the best institue and they are totally worth for.
85,10444,2017-02-20 00:00:00,q,"There are many ways: Google conducts APAC(now  Kickstart 2017 ), you may get an intern interview call if you perform well."
85,10445,2017-02-20 00:00:00,q,Apply online at  Bring questions.
85,10446,2017-02-20 00:00:00,q,Build answers.
85,10447,2017-02-20 00:00:00,q,- Google Careers Ask an existing Google employee for an internal referral.
85,10448,2017-02-20 00:00:00,q,"All these will at best give you interview calls, then it is upto your interview performance."
85,10449,2017-02-20 00:00:00,q,Best of luck !
115,10450,2017-02-20 00:00:00,q,There are many companies going great work in IoT and AI.
115,10451,2017-02-20 00:00:00,q,"Since AI and IoT Platform/Framework is provided by companies like Google, Microsoft, Amazon etc it is just matter of assembly your solution."
115,10452,2017-02-20 00:00:00,q," I think Google and Apple is doing its job well, they might not launch specific solution for a country, it is start-ups and other companies which they enabled has the job of building custom solution which suites the use case."
115,10453,2017-02-20 00:00:00,q,Example: Cooey Technologies is working on both IoT and AI to enable smart health care.
115,10454,2017-02-20 00:00:00,q,The AI based virtual assistant called Maya can help elders or patients with little agility to log and interact with their medical data and caretaker.
115,10455,2017-02-20 00:00:00,q,The Maya engine is integrated with Amazon Alexa which can bring lot of possibilities.
115,10456,2017-02-20 00:00:00,q,Note: I am one of the co-founder of Cooey
84,10457,2017-02-23 00:00:00,q,From about 150 career profiles from Google India the highest package was  ?49.0 lpa . Though it maybe more based experience and skills.
84,10458,2017-02-23 00:00:00,q,Check this out for other insights regarding the same Google India Salaries | KitnaDetiHai
44,10459,2017-03-02 00:00:00,q,A2A.
44,10460,2017-03-02 00:00:00,q,I will be very frank.
44,10461,2017-03-02 00:00:00,q,"I am in Hyderabad, attended about 30 interviews in 2 months, sometimes I traveled 2 to 3 interviews on same day."
44,10462,2017-03-02 00:00:00,q,"I din’t like any other interview, only Google interview I liked."
44,10463,2017-03-02 00:00:00,q,The liked feeling of getting interviewed by Google.
44,10464,2017-03-02 00:00:00,q,"I failed, even though I answered all."
44,10465,2017-03-02 00:00:00,q,A month passed.
44,10466,2017-03-02 00:00:00,q,"At this time, I understood 2 things: The way I answered was wrong: In the google docs, I conveyed that one problem is difficult than other problems, generally I dont do, but did this."
44,10467,2017-03-02 00:00:00,q,"At that time, I was around 600 rank, my intelligence was really raw, I dint know the complexity of many things I solved."
44,10468,2017-03-02 00:00:00,q,Complexity would surely help.
44,10469,2017-03-02 00:00:00,q,"By raw intelligence I mean, I might solve a difficult problem that most people dint solve, and may be I will not solve that one rare thing that almost 80% people solved somehow, as seen from leaderboard."
44,10470,2017-03-02 00:00:00,q,I wrote 0 test cases for each of the 3 problems.
44,10471,2017-03-02 00:00:00,q,This is a serious problem.
44,10472,2017-03-02 00:00:00,q,"When we submit an answer, our answer is checked against 20 test cases on a competitive programming website, but in google interview, you are the one who writes those test cases too."
44,10473,2017-03-02 00:00:00,q,"Sure, I dont have a habit of checking code myself (unless those green tickets or red crosses tell me), plus, I dont remember well to write a perfect answer quickly, even it’s already solved problem."
44,10474,2017-03-02 00:00:00,q,It is perfect disaster.
44,10475,2017-03-02 00:00:00,q,":-). Well, problem solvers are not required anymore, before problem solver, you must be a good problem solution recaller, its the fate to cut competition in the modern days."
44,10476,2017-03-02 00:00:00,q,"Also understood that, the good feeling I felt in Google interview, is nothing to do with Google, but it is to do with Algorithms that I like."
44,10477,2017-03-02 00:00:00,q,It is to do with the problem solving in Algorithms that I like.
44,10478,2017-03-02 00:00:00,q,"In other words, If Google interview calls me to interview for a chemist position, assuming it is there, I would not even care to attend unless for a good reason."
44,10479,2017-03-02 00:00:00,q,"In future, if Google’s business decides ‘we have nothing to do with problem solving’, then I will be like ‘I have nothing to do with Google’ I like Google for the extraordinary things that it already does & tries to do for future."
44,10480,2017-03-02 00:00:00,q,"But my like towards problem solving or algorithms is much stronger than the like towards Google or other company, so is the reason behind above like answer."
44,10481,2017-03-02 00:00:00,q,"Hope the above answer, or some parts of it helps someone."
44,10482,2017-03-02 00:00:00,q,Best of luck.
109,10483,2017-03-03 00:00:00,q,Yes.
109,10484,2017-03-03 00:00:00,q,Google has started rolling out Google Assistant to Android Marshmallow.
109,10485,2017-03-03 00:00:00,q,"However the update is currently restricted to US, Canada, UK and Australia."
109,10486,2017-03-03 00:00:00,q,So guess you will have to wait.
109,10487,2017-03-03 00:00:00,q,"But if you can't, you can install it by flashing it manually."
110,10488,2017-03-10 00:00:00,q,"You can get it now automatically if you sign up for  Google app beta  and  Google play services beta  programs, OR you can wait for it to go public for stable builds."
110,10489,2017-03-10 00:00:00,q,The good thing is that it also supports English (India) voice.
110,10490,2017-03-10 00:00:00,q,I’ve got it yesterday and found it way useful than siri or any other voice assistant as far as voice recognition and results are concerned.
110,10491,2017-03-10 00:00:00,q,A downside is that its voices are still a little bit robotic and available news sources are only from BBC.
110,10492,2017-03-10 00:00:00,q,Still worth a try!
43,10493,2017-03-11 00:00:00,q,"Hard as it may be to believe, I did not know much about Google at all when I had applied there."
43,10494,2017-03-11 00:00:00,q,This was 10 years ago.
43,10495,2017-03-11 00:00:00,q,I was terribly low on industry awareness back then.
43,10496,2017-03-11 00:00:00,q,Pretty much the only thing I had known about the company was that they had a popular search engine.
43,10497,2017-03-11 00:00:00,q,I did not know about their salaries or stocks or culture or reputation even.
43,10498,2017-03-11 00:00:00,q,I was applying only because my previous job was kinda degrading.
43,10499,2017-03-11 00:00:00,q,They had started hiring in India only in the past couple of years or so.
43,10500,2017-03-11 00:00:00,q,Couple of my ex-colleagues had gotten through to Google.
43,10501,2017-03-11 00:00:00,q,These were the sharpest in my previous company and I was told it required enormous talent to get through their interview process.
43,10502,2017-03-11 00:00:00,q,Few of my very talented friends had tried too and not gotten through.
43,10503,2017-03-11 00:00:00,q,It almost baffled me then.
43,10504,2017-03-11 00:00:00,q,I too just thought I’ll give it a shot.
43,10505,2017-03-11 00:00:00,q,There were other companies which were offering higher salaries back then and I had given them a shot too.
43,10506,2017-03-11 00:00:00,q,"Luckily, I did not get through one of the potential companies here :). Fate played its own role to take me to Google."
43,10507,2017-03-11 00:00:00,q,"So, this is how it went."
43,10508,2017-03-11 00:00:00,q,It was one of my ex-colleagues who had referred me to Google.
43,10509,2017-03-11 00:00:00,q,She was nice enough to write me a good referral.
43,10510,2017-03-11 00:00:00,q,Google was quick to process my application and I walked in un-nervously on the day of the interview.
43,10511,2017-03-11 00:00:00,q,I don’t remember how my phone interview went though.
43,10512,2017-03-11 00:00:00,q,I am sure I had cleared the basics there uneventfully.
43,10513,2017-03-11 00:00:00,q,I hadn’t cared much at that point in time about whether I’d get the job or not.
43,10514,2017-03-11 00:00:00,q,The on-site interview was fairly interesting and definitely quite intense.
43,10515,2017-03-11 00:00:00,q,I still vividly remember few of the questions I had to answer and one of them where I definitely struggled a lot.
43,10516,2017-03-11 00:00:00,q,There was this one interviewer who’d later become my friend.
43,10517,2017-03-11 00:00:00,q,The two of us would perform a fun dance event on stage in our last holiday party as we exited Google 4 years later at the same time.
43,10518,2017-03-11 00:00:00,q,His interview was the one I had found the most difficult.
43,10519,2017-03-11 00:00:00,q,There was one solution where I did not arrive at the most optimal solution despite a few hints from this guy.
43,10520,2017-03-11 00:00:00,q,I found the optimal approach ridiculously impossible.
43,10521,2017-03-11 00:00:00,q,"No matter what I tried, there was some barrier that kept preventing the solution from reducing to O(N). This guy did not meet my eyes and was constantly on his laptop, presumably taking notes."
43,10522,2017-03-11 00:00:00,q,He would ask me questions and stretch my answers with every little step I took.
43,10523,2017-03-11 00:00:00,q,He was pretty sharp but left me a bit tense about it all.
43,10524,2017-03-11 00:00:00,q,"Ultimately, I solved his questions but did not reach the last level of optimization that was presumably possible."
43,10525,2017-03-11 00:00:00,q,"Later on, I would come to know of a few people who had solved it in the interview."
43,10526,2017-03-11 00:00:00,q,But I knew I hadn’t bombed his interview either.
43,10527,2017-03-11 00:00:00,q,I had been able to analytically reason out with him on most aspects without floundering or exhibiting any lack of clarity.
43,10528,2017-03-11 00:00:00,q,I also remember another fairly senior interviewer with whom I had just cracked his medium complexity problem solving question instantly - like in 5 seconds or so.
43,10529,2017-03-11 00:00:00,q,I had the answer even as he was just finishing his question.
43,10530,2017-03-11 00:00:00,q,"Subsequently, when I would use this question with other good candidates I’d interview, I observed that several of them would take anywhere from 5–10 minutes to solve it."
43,10531,2017-03-11 00:00:00,q,"On one of the coding questions in which I started on an iterative approach, it was pretty darn hard to get things working during the time of the interview."
43,10532,2017-03-11 00:00:00,q,"Gradually, I moved over to a recursive code and got it working."
43,10533,2017-03-11 00:00:00,q,The interviewer pushed me to walk through the code path using an example and dive into the stack to demonstrate that the code had no bugs.
43,10534,2017-03-11 00:00:00,q,It was a bit of an intense exercise and required enormous concentration back then.
43,10535,2017-03-11 00:00:00,q,I had to follow a thread of thought and trace through the details several levels deep into the stack for a few minutes at a stretch.
43,10536,2017-03-11 00:00:00,q,But I got it in the end.
43,10537,2017-03-11 00:00:00,q,"Had I not taken this solution to its full completion, I am pretty sure I wouldn’t have gotten through."
43,10538,2017-03-11 00:00:00,q,"In the end, I was pretty confident that this particular interviewer would have liked me."
43,10539,2017-03-11 00:00:00,q,"And yes, I remember the lunch."
43,10540,2017-03-11 00:00:00,q,There was a buddy who took me to the Google cafeteria and I was impressed by the spread they had.
43,10541,2017-03-11 00:00:00,q,"After 3 interviews that day, I was sent back home."
43,10542,2017-03-11 00:00:00,q,I kept wondering about it in the evening.
43,10543,2017-03-11 00:00:00,q,"I could tell that they would have found my analytical and coding abilities reasonable, but there were chances they found me slow on one problem at least."
43,10544,2017-03-11 00:00:00,q,"And I had only 3 F2F interviews, so I thought may be they sent me back because they did not want to process my candidature any further."
43,10545,2017-03-11 00:00:00,q,Subsequently they called me for another interview on another day.
43,10546,2017-03-11 00:00:00,q,I solved all the questions on this one.
43,10547,2017-03-11 00:00:00,q,The high complexity problem in this interview was very straightforward in code but required a specific insight for arriving at a linear solution.
43,10548,2017-03-11 00:00:00,q,"I was solid in my reasoning, but took my time and solved the problem."
43,10549,2017-03-11 00:00:00,q,I never floundered or left my confidence shake at any point.
43,10550,2017-03-11 00:00:00,q,I kept pushing until I had solved it.
43,10551,2017-03-11 00:00:00,q,"As I’d depart again from the office, I noticed the interviewer go out for a smoke and look pensive."
43,10552,2017-03-11 00:00:00,q,"Back then, I had thought that he was maybe thinking about how the interview went, but now I think he may have just stepped out for his regular break with N different things in his head where I may have likely not been a part."
43,10553,2017-03-11 00:00:00,q,"Later on, I had run into this guy several times at Google and he wouldn’t recognize me."
43,10554,2017-03-11 00:00:00,q,He always hosted the same solitary pensive look.
43,10555,2017-03-11 00:00:00,q,"Finally, the offer came."
43,10556,2017-03-11 00:00:00,q,They had liked my profile and took me in.
43,10557,2017-03-11 00:00:00,q,I was happy to take it up.
43,10558,2017-03-11 00:00:00,q,"They had, in fact, hired me to play the role of a tech lead of a new monetization project in YouTube."
43,10559,2017-03-11 00:00:00,q,This was the time when Youtube was bleeding money and they were just beginning to work on some innovative ideas to start monetizing it.
43,10560,2017-03-11 00:00:00,q,"But all this happened to me, while I had not even known what sort of a phenomenal company they are."
43,10561,2017-03-11 00:00:00,q,"In retrospect, I feel quite lucky for getting an opportunity to work at this absolutely wonderful company."
43,10562,2017-03-11 00:00:00,q,"Till date, the smartest technical people I have interacted with, date back to this place."
43,10563,2017-03-11 00:00:00,q,That was my interview experience.
43,10564,2017-03-11 00:00:00,q,"Pretty uneventful overall, but few events of the day still stay vivid in my memories."
43,10565,2017-03-11 00:00:00,q,"When I recollect the whole thing today, it always ends with a recollection of the street in which I had walked back thoughtfully after the last interview and the traffic scene on the road near the junction where St."
43,10566,2017-03-11 00:00:00,q,Mark’s road and Residency Road met.
43,10567,2017-03-11 00:00:00,q,"The honking sounds of vehicles all seem to come from very far away, but I realize that is just how my memory portrays the scene today."
78,10568,2017-03-15 00:00:00,q,I don’t understand the point of such questions being asked.
78,10569,2017-03-15 00:00:00,q,"It’s not exactly like Google comes in through to ISI gate, points at a random person and hands him a job."
78,10570,2017-03-15 00:00:00,q,It’s not lottery … I don’t know who have given you an impression such as that.
