review_id,sentence_id,Time,sentence_type,sentence
112,10747,2017-04-17 00:00:00,q,"As an example, within the Make in India program, India must create special incentives for manufacturers, such as relaxing regulations and lowering trade barriers, so they: Invest in automation research in India by building research labs and design studios in India Create regional innovation clusters, districts, and corridors by building strong linkages around manufacturing automation and robotics between universities and start-ups in India Make India a global hub for machine intelligence–based innovation in manufacturing Similarly, the Skill India initiative should be reworked with the twin objectives of being resilient to skills obsolescence through market-based instruments that tie together the employers, the training institutes, and the students as well as paying special attention to new skills needed to survive in an AI-led economy in the future."
112,10748,2017-04-17 00:00:00,q,Digital India must be reconfigured to establish cloud infrastructure inside India on a fast-track basis: the limited capacity as it stands today is a critical infrastructure gap and a national security risk.
112,10749,2017-04-17 00:00:00,q,"As a part of the Digital India initiative, New Delhi must create specific incentives for building large-scale data centers in India, ideally in partnership with the state governments."
112,10750,2017-04-17 00:00:00,q,"The government must identify specific regions in India that are geographically suited for building massive data centers, with an assured supply of power and other critical public infrastructure required for such facilities, and promote these as preferred destinations for investment in cloud infrastructure in India under the Digital India scheme."
112,10751,2017-04-17 00:00:00,q,"The spirit of Startup India, that of creative destruction rather than protectionism, must be allowed to prevail."
112,10752,2017-04-17 00:00:00,q,Recent regulatory decisions in India across cities and states bearing down on taxi aggregators Uber and Ola are regressive and counterproductive; these well-intentioned regulations must be eliminated if AI is to achieve its full potential.
112,10753,2017-04-17 00:00:00,q,"Unless the government and domestic industry allow the marketplace to experiment with untested business models enabled by the so-called peer economy, it is unlikely that the economy will create jobs resilient to and in an AI-driven economy."
112,10754,2017-04-17 00:00:00,q,"It is imperative to recognize that improving start-ups’ ease of doing business is not merely a regulatory measure to incubate or liquidate a business, but also a free market initiative to allow new and efficient business models to thrive."
112,10755,2017-04-17 00:00:00,q,"For the first time in the history of democratic India, the formulation of a new education policy has been undertaken with a nationwide process of consultation and crowdsourcing."
112,10756,2017-04-17 00:00:00,q,The massive task of analyzing the inputs received and devising the new policy is challenged both by the volume of the inputs and the complexity of myriad issues across India.
112,10757,2017-04-17 00:00:00,q,"Formulating the new education policy must not, however, be based solely on inputs received that are affected by current challenges, constraints, and limitations."
112,10758,2017-04-17 00:00:00,q,"The National Education Policy must take a long-term view of the skills economy, evaluate the continued relevance of the current system of sequential education, and make radical recommendations on alternative models of education that would be better suited to the economy of the future."
112,10759,2017-04-17 00:00:00,q,Piloting and experimenting in such new models of education must commence in the immediate future before the rapid obsolescence of the current system begins.
112,10760,2017-04-17 00:00:00,q,Medium-Term Applications of AI in the Public Sector The government should identify public-sector applications in India where current advances in AI could make a significant impact toward building skills and capabilities domestic applications of AI.
112,10761,2017-04-17 00:00:00,q,"For example, New Delhi could: Apply AI-based techniques to recognize patterns and learn about tax evasion behavior, in an effort to mine public databases to detect tax fraud and money obtained illegally with the goal of minimizing tax evasion and maximizing tax revenue Use AI to scan records, recognize patterns of fraud, and correlate subsidy claims with other consumer data to help detect leakages of subsidies and to learn and better target direct benefits to citizens through interventions most relevant to them Develop natural language–processing capabilities to automate multilingual communication and interactivity across a whole range of government services and interfaces, for example, crowdsourcing via  MyGov: A Platform for Citizen Engagement towards Good Governance in India , voice calls, automated helplines, and chatbots for the most routine citizen-government interactions Use AI-based training and teaching software in various skilling and educational applications In each of these areas, the government should collaborate with the private sector and university research labs to leverage existing technologies effectively and to rapidly create new technologies to address specific and well-defined problems."
112,10762,2017-04-17 00:00:00,q,Long-Term Strategy India must view machine intelligence as a critical element of its national security strategy.
112,10763,2017-04-17 00:00:00,q,"At a time when AI is being viewed as a key component of foreign policy between the United States and Japan, with similar proposals of treatment being floated in India, the Indian government must formulate a national strategy on emerging technology trends with long-term strategic consequences."
112,10764,2017-04-17 00:00:00,q,India must seriously evaluate the DARPA model of defense research in conjunction with private sector and university collaboration in order to create dual-purpose technologies with a scope large enough to allow for development of civilian technology applications.
112,10765,2017-04-17 00:00:00,q,"Specifically, the Cyber Grand Challenge model of DARPA needs to be examined for its successful incentivization of academia and the private sector."
112,10766,2017-04-17 00:00:00,q,India must view machine intelligence as a critical element of its national security strategy.
112,10767,2017-04-17 00:00:00,q,"The proposed National Intelligence Grid (NATGRID) platform, which would link citizen databases, might be a good pilot candidate for creating a machine intelligence–based platform with both national security and civilian benefits and should thus be taken up on a mission mode."
112,10768,2017-04-17 00:00:00,q,"Another possibility is Aadhaar, a platforms-based approach to governance founded on massive data sets, which builds on the possibility articulated in  Rebooting India . Authors Nandan Nilekani and Viral Shah enumerate five data-based platforms that could address a broad range of governance challenges."
112,10769,2017-04-17 00:00:00,q,"Expanding this list to ten public databases encompassing state and local governments would enable a robust machine intelligence architecture capable of plugging leakages in subsidies, better targeting benefits, and expanding the tax base."
112,10770,2017-04-17 00:00:00,q,"Conclusion From NATGRID to Aadhaar, machine intelligence–powered platforms can become a strategic instrument of governance in India across a wide range of public services."
112,10771,2017-04-17 00:00:00,q,These platforms are not without their challenges: a machine intelligence–powered approach to governance will require robust digital privacy laws and a code of ethics on limits to using AI.
112,10772,2017-04-17 00:00:00,q,"However, the range of AI’s possibilities is so vast that the full spectrum of its opportunities is difficult to fully comprehend."
112,10773,2017-04-17 00:00:00,q,"While India may be late to wake up to the AI revolution, Indians of many hues—consumers, technocrats, researchers, and entrepreneurs—are already participants in this revolution with many of Indian origin driving and influencing research in the United States and elsewhere."
112,10774,2017-04-17 00:00:00,q,"A clarion call from the prime minister to all of them, to come together and help build an AI ecosystem in India, will go a long way for India to not merely catch up to but to take a quantum leap into the AI-driven future."
112,10775,2017-04-17 00:00:00,q,Source Links: IoT League- Internet of things http://carnegieindia.org
114,10776,2017-04-18 00:00:00,q,"To be honest, there isn’t much AI in practice right now."
114,10777,2017-04-18 00:00:00,q,Just because smartphone sales are rising does not mean its a natural extension for AI.
114,10778,2017-04-18 00:00:00,q,"Google, Microsoft, Amazon and a few other large tech giants are working towards platforms that help IoT devices talk to each other."
114,10779,2017-04-18 00:00:00,q,"They also plug their products from other portfolios to add services such as visualization engines, big-data analytics etc."
114,10780,2017-04-18 00:00:00,q,These companies are not launching products in the IoT space directly but are maing the tools to help other companies developing IoT products.
114,10781,2017-04-18 00:00:00,q,AI and IoT are seemingly different areas.
114,10782,2017-04-18 00:00:00,q,"AI relies on large data sets that have reasonably well qualified and tuned data coming from devices, systems and other sources."
114,10783,2017-04-18 00:00:00,q,An AI engine then has the physical and virtual power to analyze this data in real time to make decisions faster than humans.
114,10784,2017-04-18 00:00:00,q,IoT devices are just one of the sources that feed data into AI systems.
114,10785,2017-04-18 00:00:00,q,The issue in India is the lack of infrastructure to collect such data in the first place.
114,10786,2017-04-18 00:00:00,q,"Owing to the bureaucratic government processes, we still have a large collection of legacy systems that either do not have interfaces for automated data collection (barring a few industries such as financial systems etc.) or are not able to interconnect to a larger networks."
114,10787,2017-04-18 00:00:00,q,Also the core purpose of an AI is to do something better and faster than us humans.
114,10788,2017-04-18 00:00:00,q,"As such the promise of AI is well-founded however, bringing in the associated infrastructure needed for it is difficult if not impossible."
114,10789,2017-04-18 00:00:00,q,"There are several startups working in niches such as logistics, biomedical and healthcare that rely on IoT and AI to solve real world problems."
114,10790,2017-04-18 00:00:00,q,"However, these are very nascent and too small to make an impact right away."
28,10791,2017-04-19 00:00:00,q,"It is still in the Development Mode, it will be soon available india"
29,10792,2017-04-19 00:00:00,q,Its still in development for India! It will be available soon! If you want to use google earth in India then visit the link below to know more about it! Eke Sel - Everything You need to Know About Google Earth 2.0 Thanks!
52,10793,2017-04-24 00:00:00,q,Yes.
52,10794,2017-04-24 00:00:00,q,Google Home does work in India.
52,10795,2017-04-24 00:00:00,q,You could most of the cloud based services of information.
52,10796,2017-04-24 00:00:00,q,The glitch is that it has very low associativity with the hardware and automation tools launched in Indian market.
52,10797,2017-04-24 00:00:00,q,And there are hardly any public services in India which are Google Home compiatable.
52,10798,2017-04-24 00:00:00,q,"So, you could always use it for sourcing information sitting comfortably on the couch or setting reminders for your day."
104,10799,2017-04-25 00:00:00,q,If you’re not from a good college then it’s going to be tough.
104,10800,2017-04-25 00:00:00,q,"Focus on your coding skills from first year, go through algorithms so that you can implement any algorithm with both eyes closed."
104,10801,2017-04-25 00:00:00,q,"There are chances you won’t land up in Google India straight after passing from your college, but if you’ll work hard and keep brushing your programming skills on HackerRank, Codechef, Topcoders, there are chance Google India will find you."
104,10802,2017-04-25 00:00:00,q,"Also, having a blog helps a lot, as it shows your skills more than you can sum up in one page resume."
104,10803,2017-04-25 00:00:00,q,For more career tips you can follow me on Quora :) Happy Hacking!
24,10804,2017-04-30 00:00:00,q,There is no need to take hasty decisions at the present moment.
24,10805,2017-04-30 00:00:00,q, Donald Trump’s new H1B policy with tweaks  has not yet been revealed  and we do not know to what extent it is going to harm India.
24,10806,2017-04-30 00:00:00,q,For all we know it can also turn out to be pro-India.
24,10807,2017-04-30 00:00:00,q,Or it could be shoved aside like  TrumpCare . That being said every country has right to protect its citizen’s right and have their own laws and accords.
24,10808,2017-04-30 00:00:00,q, This is called sovereignty.
24,10809,2017-04-30 00:00:00,q," Although US may not know its meaning ( think Iraq ), but we Indians do."
24,10810,2017-04-30 00:00:00,q,We should let US draft its policies first and then decide our counter move.
24,10811,2017-04-30 00:00:00,q,"Nevertheless, I do not think that there would a major change in the policy as to make it anti-Indians or Chinese for that matter because American companies are making money from Indian soil too."
24,10812,2017-04-30 00:00:00,q,"Donald Trump has showed one view of the policy which depicts Indians and Chinese taking up American jobs (which by the way is not true) , however he has not shown the other side where Indian companies provide employment to the Americans or allow reduction in tariffs and easier laws for ease of American business."
24,10813,2017-04-30 00:00:00,q,"However, if uneventfully there is a major change and it is anti-Indian then you could expect a trade war between India and US."
24,10814,2017-04-30 00:00:00,q,"It may also lead to potential banning of Facebook, WhatsApp, Google etc."
24,10815,2017-04-30 00:00:00,q,Initial days and months would be tough for us Indians but we will overcome it.
24,10816,2017-04-30 00:00:00,q,No trade can happen between countries without a win-win situation.
24,10817,2017-04-30 00:00:00,q,Another way to look at this situation would be through the views of American companies.
24,10818,2017-04-30 00:00:00,q,Most American companies are not truly American.
24,10819,2017-04-30 00:00:00,q,They are MNCs whose operations are based in the Silicon valley.
24,10820,2017-04-30 00:00:00,q,So if the H1B process is anti-Indian then it means it would be anti-them too.
24,10821,2017-04-30 00:00:00,q,This would lead them to pull out of the country and base their operations elsewhere.
24,10822,2017-04-30 00:00:00,q,Certainly not a way to make America great.
24,10823,2017-04-30 00:00:00,q,Image source - Google images
26,10824,2017-04-30 00:00:00,q,"First option - if you have any people in contact, working there, try to contact them."
26,10825,2017-04-30 00:00:00,q,"Second option - log in to internshala Third option - innovative something that will force these companies to get an eye catch of ur talent Fourth option - try to attend as many as possible conference, seminars or workshops conducted by different programming tutorial companies and thus create your own network."
77,10826,2017-04-30 00:00:00,q,There are various departments and stuffs that is offered by companies like Google for MBA students.
77,10827,2017-04-30 00:00:00,q,Depends on the position and requirements.
77,10828,2017-04-30 00:00:00,q,Google is a whole ecosystem.
77,10829,2017-04-30 00:00:00,q,So it requires not only developers or software engineers but everyone else also! Anyone can apply holding any background or knowledge related to any field.
77,10830,2017-04-30 00:00:00,q,Remember Sundar Pichai was not a CS student? You can search relevant jobs here:  Bring questions.
77,10831,2017-04-30 00:00:00,q,Build answers.
77,10832,2017-04-30 00:00:00,q,- Google Careers
25,10833,2017-05-01 00:00:00,q,"No, But Indian’s need to use own  social networking  platform in order to increase Swadeshi campaign."
75,10834,2017-05-05 00:00:00,q,"Google on Friday launched a 'Solve for India' initiative under which it will reach out to entrepreneurs in cities like Indore, Nagpur and Madurai to help them develop solutions in areas like agri-tech, healthcare and sanitation."
75,10835,2017-05-05 00:00:00,q,The programme will provide a platform to developers and entrepreneurs in smaller cities to hear from experts and gain access to direct mentoring and support from Google.
75,10836,2017-05-05 00:00:00,q,"Commenting on the development, an official statement from Google said, “The programme will provide a platform for developers, entrepreneurs in Tier II cities to hear from experts and learn about the latest Google technologies and get access to direct mentoring and support from Google.” Google aims to reach over 10,000 developers and entrepreneurs this year alone through the programme."
75,10837,2017-05-05 00:00:00,q,"The company will also share product usage insights and help the entrepreneurs build solutions across areas like agri-tech, healthcare, transportation, education and sanitation, among others."
75,10838,2017-05-05 00:00:00,q,The focus will also be on developing mobile first solutions with strong offline and language capabilities.
75,10839,2017-05-05 00:00:00,q,"Google will take the initiative to cities like Pune, Jaipur, Hyderabad, Kolkata, Kochi, Indore, Nagpur, Nashik, Madurai, Kanpur and Chennai."
75,10840,2017-05-05 00:00:00,q,"There are growing number of entrepreneurs in smaller Indian cities who are focusing on building solutions that cater to the real needs of India, Google India Programme Manager Lead Karthik Padmanabhan said in a statement."
75,10841,2017-05-05 00:00:00,q,"""Through this initiative, we want to bring the best of Google under one programme and join forces with them to help create solutions that serve the needs of a billion Indians,"" he added."
23,10842,2017-05-06 00:00:00,q,Google is an amazing place to work with so many benefits and perks.
23,10843,2017-05-06 00:00:00,q,One of the best perk to me thus far has been the ability to move roles based on your interest and future career aspirations So far in 2years what I have noticed at Google People move cross functions like from Ads to Maps.
23,10844,2017-05-06 00:00:00,q,I know a few people who even moved from Ads to Engineering teams People also move countries.
23,10845,2017-05-06 00:00:00,q,"I have few of my own colleagues who moved to US, Australia, Japan, Singapore, Dublin for various reasons."
23,10846,2017-05-06 00:00:00,q,"People also move across India too like Hyd to Mumbai or Gurgaon So the answer is  yes , you can get a job at Google India and internally apply for roles in Zurich or any other place accross the world where Google has an office."
23,10847,2017-05-06 00:00:00,q,"Provided your application is internally approved by your manager and you clear the interviews required for the new role.( Internal interviews are more role related and not to check your personality or Googleyness) Also, Google India has a team which helps you filing work Visa documentation for various countries."
23,10848,2017-05-06 00:00:00,q,This shows how common this practice is :) Hope this helps!
22,10849,2017-05-07 00:00:00,q,It’s very common for Googlers across the globe to change there job internally and relocate to another country.
22,10850,2017-05-07 00:00:00,q,Google India is no different.
22,10851,2017-05-07 00:00:00,q,I have personally seen many move out of Google India.
22,10852,2017-05-07 00:00:00,q,The most common destination is usually United States for Indian Googlers.
22,10853,2017-05-07 00:00:00,q,"That said, if there is an opening in Zurich, the process for transfer is still the same."
22,10854,2017-05-07 00:00:00,q,Caveats : Every country has different immigration rules.
22,10855,2017-05-07 00:00:00,q,You may or may not be eligible for transfer to a different country due to VISA rules.
22,10856,2017-05-07 00:00:00,q,Google cannot help you there.
22,10857,2017-05-07 00:00:00,q,There is usually a fixed amount of time you will have to spend in your current job if you want to relocate.
22,10858,2017-05-07 00:00:00,q,This usually varies from 12 to 18 months.
22,10859,2017-05-07 00:00:00,q,I am guessing that under exceptional cases you may transfer before 1 year but I haven’t seen anyone like that.
22,10860,2017-05-07 00:00:00,q,"Sometimes, the whole team decides to relocate to a different country in which case you can choose to stay in your current location and find a different team or relocate with the team."
27,10861,2017-05-07 00:00:00,q,*LinkedIn would be one of the choice to reach out to your existing seniors/contact.
76,10862,2017-05-07 00:00:00,q,"At what level? I am not telling about GOOGLE, but any reasonable front line tech comp , e.g Intel, Qualcom, Broadcom, Amazon, Microsoft, etc."
76,10863,2017-05-07 00:00:00,q,"I'm not mentioning General Dynamics, some of the IBM, Prat Witney, etc; where Indian or non American are not taken for obvious reasons."
76,10864,2017-05-07 00:00:00,q,If someone with +15 yrs proper experience may get around +60L/yr CTC.
76,10865,2017-05-07 00:00:00,q,Let me put an example : biggest public sector bank of India SBI CEO gets 30L/yr and biggest private sector bank ICICI CEO gets 4-4.5 Cr/yr.
76,10866,2017-05-07 00:00:00,q,But does money matters all time?…may not be.
21,10867,2017-05-11 00:00:00,q,As far as my knowledge is concerned I don't think google doesn't hold or ever faintly hesitate itself from hiring people with physical disability as long as that individual is able enough to offer that the job designation requires from him.
21,10868,2017-05-11 00:00:00,q,Although I feel it my duty to clear that it is highly unlikely that google favors the people with physical disability with a quota of some sorts.
21,10869,2017-05-11 00:00:00,q,You as an individual have to offer the expertise that they require and if you can then google won't hesitate from recruiting you.
73,10870,2017-05-11 00:00:00,q,No we don't have any offices in Kolkata.
73,10871,2017-05-11 00:00:00,q,"Google India has offices in Hyderabad, Gurgaon, Mumbai and Bangalore."
20,10872,2017-05-12 00:00:00,q,Every role at Google requires a certain skill set.
20,10873,2017-05-12 00:00:00,q,You will need to have those skills for you to be hired.
20,10874,2017-05-12 00:00:00,q,No way around it.
20,10875,2017-05-12 00:00:00,q,"Along with this skill set, you will also need to have  Googliness . It’s a intangible ‘good’ stuff in a person."
20,10876,2017-05-12 00:00:00,q,Cannot be defined very easily but you know it’s there as soon as you see it.
20,10877,2017-05-12 00:00:00,q,"As long you have the skillset and Googliness [1] , Google is going to want to hire you."
20,10878,2017-05-12 00:00:00,q,It doesn’t matter what else you think you might be disabled by.
20,10879,2017-05-12 00:00:00,q,Google doesn’t care.
20,10880,2017-05-12 00:00:00,q,It’s one of the many things I love about this company.
20,10881,2017-05-12 00:00:00,q,"In fact, I’ll even go out and say that if you feel you’re disabled - physically or otherwise, Google is going to go out of its way to 1."
20,10882,2017-05-12 00:00:00,q,Assure you that it won’t affect your growth and 2.
20,10883,2017-05-12 00:00:00,q,Do all it can to ensure that you don’t feel that way.
20,10884,2017-05-12 00:00:00,q,This place brings me to tears :’) Footnotes [1]  Missions That Matter
113,10885,2017-05-12 00:00:00,q,"With reference to Zinnov’s latest report on Internet of Things (IoT), I observe a sign of tremendous growth all across the globe and specifically in India."
113,10886,2017-05-12 00:00:00,q,"It is estimated by Zinnov, that by 2020 the IoT market will increase 3x from $5.6 billion (2015) to $15 billion (2020) in terms of revenue."
113,10887,2017-05-12 00:00:00,q,"This correspondingly brings focus to the total rise in IoT devices in India which was earlier 0.2 billion (2015) and now estimated to reach 2.7 billion (2020). It can be related with the increased public private partnered initiatives like Smart Cities, Digital India etc."
113,10888,2017-05-12 00:00:00,q,India is presently observing a surge in Consumer IoT segment over other Enterprise and Industrial IoT segments due to the widely spreading smartphone market which have micro-targeted specific features to bridge the gaps of their target audience who prefer them only at affordable prices.
113,10889,2017-05-12 00:00:00,q,"For example, Chinese brands like Vivo, Gionee & Oppo are targeted on Camera which caters the needs of feature phone users who lacked this capability earlier."
113,10890,2017-05-12 00:00:00,q,This has cascaded effects on the different use cases developed on top of these features by different tech startups like AR visualization with connectivity to social media and analytic engines to help improve customer experiences.
113,10891,2017-05-12 00:00:00,q,"Presently, about 50% of these innovative IoT tech-startups are budding in Bengaluru."
113,10892,2017-05-12 00:00:00,q,"As per the report, major IoT startups in India focus on Infrastructure & Application modules of the IoT stack."
113,10893,2017-05-12 00:00:00,q,"Telecom & Internet service providers like Jio & other MSO companies have stimulated the urging need of high speed data among consumers, which has eventually triggered focus on networking modules in the stack."
