review_id,sentence_id,Time,sentence_type,sentence
55,10190,2015-08-11 00:00:00,q,Sneakcast  – Videos search Video sharing Interval Contextual Widgets hover.in Minekey Localized apps Paahijen Internet Music Streaming Hummaa Rhydhun Dhingana Music Streaming for Independent artists Muziboo Tempostand Radioverve Job Portals Reffster Criticat  –  Post Talentty Coders2020 CoCubes  – Connecting companies and colleges Study Related Uniguru Professional Blogging/Blog Directory WATBlog IndiBlogger.in  –  Post BlogAdda  – Post Marketing/Ad Agency Phonethics Social Networks Buzzintown  – Discover local events Revvs.net  – Social network for F1 fans CommonFloor  – Social Network for people staying in bigger flats.
55,10191,2015-08-11 00:00:00,q,Nunook  – Games + Social network Deal aggregators DealMaadi AllIndiaDeals SingDeals OnlineDeals Micro Finance Dhanax Restaurant Reviews NeedGrub Burrp MealPundit HungryZone  – Online food catering Real estate Search Zamanzar It goes only to show in India there are not ample and apt opportuniteis to nurture talent and hence meritocratic people are forced to work at the mercy of US tech giants who value their talent and use them up wholly and rebranding all the innovations in their name.Its sad but thats the reality Sir.Hopefully picture will change in next 10-20 years.
56,10192,2015-08-11 00:00:00,q,Have you heard about micromax?
79,10193,2015-08-11 00:00:00,q,"Short Answer : No Long Answer: The guy made it himself . Because he was born in India ,got his bachelors from India , there's attachment but you just can't take credit for his success."
79,10194,2015-08-11 00:00:00,q,"Sundar started as Product managers , worked hard for 11 years . It is his hard work, all credits goes to him only."
81,10195,2015-08-11 00:00:00,q,I don't think so 'credit' is the right word here . But Indians can definitely feel proud about it .India is the country which provided him the platform to groom himself.
81,10196,2015-08-11 00:00:00,q,United States might have made him a great leader or capable CEO but first India made him a great engineer (with due respect to the  talent sundar possesses and the contributions made by his family members)
83,10197,2015-08-11 00:00:00,q,Noo..not India...but yes the nationality should get the credit..Hats off to the man n of course T he Indians ..we can make anything possible:)
82,10198,2015-08-13 00:00:00,q,NO!! We as Indians are happy for him but today whatever he has achieved is only because of his planing and hard work and full credit should go to him and his family.
58,10199,2015-08-16 00:00:00,q,"Fortunately, that relationship has  been  and is already well leveraged."
58,10200,2015-08-16 00:00:00,q,"The first generation of Indian workforces which migrated after graduating from top schools (like IITs) in the 1960s and 70s, are  now  executives, investors and Professors in areas where they have helped offshore work to India."
58,10201,2015-08-16 00:00:00,q,The IT-boom in India was enabled quite efficiently due to the lobbying efforts of this generation of Indian-Americans.
58,10202,2015-08-16 00:00:00,q,"Similarly, this small population wields a disproportionate political acumen (relative to its size, probably negligible as a whole though), which is pushing for greater business co-operation and even the original nuclear deal."
58,10203,2015-08-16 00:00:00,q, It was this group which cheered for Modi at Madison Square Garden as they were cheering for India and for themselves.
58,10204,2015-08-16 00:00:00,q,"But  overall, the South Asian community in the USA is <4 million total, while the East Asian origin community is at least 10 million."
58,10205,2015-08-16 00:00:00,q,Thus these countries have a much larger clout in terms of cultural impact and visible presence in  Amreeka.
58,10206,2015-08-16 00:00:00,q," Given the size of the desi community and much more  recent  history of migration there, I doubt it can increase beyond present levels."
80,10207,2015-08-19 00:00:00,q,"The question is if India wants to take credit for Sundar Pichai’s success, why in the world, he had to move to the US for better prospects? Let success or failure be an individual phenomenon."
80,10208,2015-08-19 00:00:00,q,"When the society does not support an individual during his failures, it doesn’t deserve to share the joy of his/her success."
80,10209,2015-08-19 00:00:00,q, Page on linkedin.com
53,10210,2015-09-11 00:00:00,q,If you are really good than you don't need to be afraid of going to US or MS once you are  there.no  one care about the past academics.they would emphasize on B.tech cgpa.find a universiy in california and you would land up in microsoft/google/FB/apple/IBM.
59,10211,2015-09-28 00:00:00,q,In india google map is accurate whis precious gps location U have to provide extreme gps settings to get accurate location It works very good...........
60,10212,2015-09-29 00:00:00,q,It is almost fine . But not updated frequently . You may not see new roads very soon in the maps.
36,10213,2015-10-27 00:00:00,q,Join a consultant/body shopper in US and get in there first on an H1.
36,10214,2015-10-27 00:00:00,q,There are quite a few out there ready to make money by placing you at some local company once you reach there.
36,10215,2015-10-27 00:00:00,q,They take the risk of getting you out there and get paid by charging commissions while placing you at some local company on contract position.
36,10216,2015-10-27 00:00:00,q, Apply for MSFT/Google once you are on H1 out there.
36,10217,2015-10-27 00:00:00,q,H1 transfer is something MSFT/Google would readily do after they interview you multiple times over the phone and for a whole full day on campus face to face.
36,10218,2015-10-27 00:00:00,q,and follow the following steps.
36,10219,2015-10-27 00:00:00,q,"1)Make your resume stronger.Participate in codechef , interviewstreet etc 2)Some big companies also have 24 hr coding events on interviewstreet etc 3)Amazon recently had a code ninja event.They also have code ninja on their website.If you solve that you may get a interview call Last : prepare hard by going to  Programming Interview Questions | CareerCup And yes i have seen people from tcs get into amazon."
36,10220,2015-10-27 00:00:00,q,Its very difficulty but not impossible.
36,10221,2015-10-27 00:00:00,q,CGPA does not matter for big companies .I have seen 9 pointers who suck at coding.
36,10222,2015-10-27 00:00:00,q,"Most impt thing :You need to passionate for coding.If you are not then there is no point . Another approach (Indirect but more feasible) : Get into some decent product dev company like oracle , symantec, pega."
36,10223,2015-10-27 00:00:00,q,Having this name on your resume will increase your chances of getting call from big companies.
36,10224,2015-10-27 00:00:00,q,Bipul Jaiswal
93,10225,2015-11-20 00:00:00,q,Thank you for A2A.
93,10226,2015-11-20 00:00:00,q,"But sorry, I'm not the right person to answer this."
93,10227,2015-11-20 00:00:00,q,"I don't have a sufficient knowledge on this topic, so i suggest you to inquire about this in the search bar of Quora."
93,10228,2015-11-20 00:00:00,q,You will find lot of related queries and you may fight best answers written by the industry experts.
93,10229,2015-11-20 00:00:00,q,You will be guided in a right manner there.
93,10230,2015-11-20 00:00:00,q,"So many students have queries related to this, you may search for those topics in the search bar, and even you will get to know what kind of preparation is needed for your query."
93,10231,2015-11-20 00:00:00,q,All the best.
57,10232,2015-12-15 00:00:00,q,India should leverage this clout by getting higher education infrastructure strengthened in India.
57,10233,2015-12-15 00:00:00,q,"One way this can be done by improving indigenous research facilities, and making them more accessible to people, in more institutes."
57,10234,2015-12-15 00:00:00,q,This would give impetus to industry as well as academia.
57,10235,2015-12-15 00:00:00,q,"Indians are hungry for knowledge, and I've sensed the yearning for higher education in many people I've known."
57,10236,2015-12-15 00:00:00,q,"This results in many people leaving the country, whereas if the scope, opportunity and infrastructure for cutting edge research was improved in India - say, by procuring expensive capital equipment for research - we'd open up Indian academia to many more people."
57,10237,2015-12-15 00:00:00,q,Thanks for the A2A.
69,10238,2016-02-20 00:00:00,q,Start with Moment of Inspiration 3D.
69,10239,2016-02-20 00:00:00,q,MoI3D.
69,10240,2016-02-20 00:00:00,q,It's a very simple software that will introduce you to the concept of nurbs modelling.
69,10241,2016-02-20 00:00:00,q,"You can parallely branch out to three domains, viz Parametric Modelling, SubD modelling, and Hybrid Modelling (a combination of the two, eg TSplines technology) "
37,10242,2016-03-19 00:00:00,q,Applying directly and getting a job is very very hard.
37,10243,2016-03-19 00:00:00,q,Check jobs in amazon or Google us and apply on them.
37,10244,2016-03-19 00:00:00,q," Some of the time if your profile,  skills sets are high they do take interview but the complexity rate is too Damm high but if you manage to Crack that all visa sponsorship will be done."
37,10245,2016-03-19 00:00:00,q," Other easy way,  Join any MS program,  it will good for your career as well."
37,10246,2016-03-19 00:00:00,q," During MS,  make sure to score high and build things,  keep a good contact with professors."
37,10247,2016-03-19 00:00:00,q," There will be a good chance of getting internship in Google or ms,  perform well,  job visa all is yours including degree from good University"
116,10248,2016-03-20 00:00:00,q,Whether to be an IAS or take up a job at Google will vary from person to person.
116,10249,2016-03-20 00:00:00,q," Those people having an inclination towards technology, love coding, solving problems will find Google job more appealing."
116,10250,2016-03-20 00:00:00,q,"While those who enjoy working with people, multitasking, doing plenty of repetitive work and man management are inclined towards civil services."
116,10251,2016-03-20 00:00:00,q," Also, a job at Google is financially far more remunerative than that of an IAS."
116,10252,2016-03-20 00:00:00,q,"An IAS has to work really hard, maneuver through political hurdles (given one really wants to work), tackle difficult people, etc."
116,10253,2016-03-20 00:00:00,q,In return the rewards may not be that lucrative and can even lead to a political backlash.
116,10254,2016-03-20 00:00:00,q,Whereas at Google the challenges are more technical in nature.
116,10255,2016-03-20 00:00:00,q,But in civil services there is a satisfaction of contributing to the society and directly affecting the lives of millions of people.
116,10256,2016-03-20 00:00:00,q,The diversity of job profiles an IAS holds is immense which is not there in a Google job.
116,10257,2016-03-20 00:00:00,q,"But still it remains a matter of choice whether one wants to be an expert at one thing and keep doing it throughout life or be a generalist, a jack of all trades."
116,10258,2016-03-20 00:00:00,q,The former suits a Google job and the latter IAS.
117,10259,2016-03-20 00:00:00,q,This is a very very very subjective question.
117,10260,2016-03-20 00:00:00,q,"People might give you complicated and logical answers but if you LOVE being a coder (I am assuming thats your position at Google) or if you LOVE being in the administrative service, you have your answer."
117,10261,2016-03-20 00:00:00,q," They are both good options and the highest achievable options in those fields, so its just a matter of knowing what you really want to do in life and what you love."
117,10262,2016-03-20 00:00:00,q, This is all based on what the individual loves.
117,10263,2016-03-20 00:00:00,q, 
118,10264,2016-03-20 00:00:00,q,"IAS, it's about respect and service than salary."
118,10265,2016-03-20 00:00:00,q,"You can be the CEO of Google as well, but the Number of lives you can touch and impact directly or indirectly is more in an IAS in 30yrs of your service."
118,10266,2016-03-20 00:00:00,q,This is my view.
119,10267,2016-03-20 00:00:00,q,Surely I will select IAS.
119,10268,2016-03-20 00:00:00,q,Because by joining IAS I can serve people to a minimum level atleast.
119,10269,2016-03-20 00:00:00,q,"Though google can also enables, but my personal interest is to take IAS."
119,10270,2016-03-20 00:00:00,q,"As answered by others, It depends upon personal interest too."
91,10271,2016-04-13 00:00:00,q,Yes I have seen Google having open positions for Android developers in Google Hyderabad via Linkedin .
103,10272,2016-04-16 00:00:00,q,Rs.
103,10273,2016-04-16 00:00:00,q,199 Wasted Successfully! In Short: 1.
103,10274,2016-04-16 00:00:00,q,I see pixels! 2.
103,10275,2016-04-16 00:00:00,q,Videos are Blurred 3.
103,10276,2016-04-16 00:00:00,q,Magnetic button does not work on my phone (Lenovo K3 Note). Its only good for a one time experience.
103,10277,2016-04-16 00:00:00,q, Read below in detail: So I saw this Google cardboard DIY from  Getcardboard.in  on Amazon India.
103,10278,2016-04-16 00:00:00,q,"It was the #1 Bestseller and had around 1000 reviews at the time of my purchase (last week) and I immediately ordered one! My experience with this is below par, I would say bad."
103,10279,2016-04-16 00:00:00,q,The screen just appears magnified with significant loss in quality.
103,10280,2016-04-16 00:00:00,q,"It's pixelated and feels like watching a video on some old 2.8"" screen phone."
103,10281,2016-04-16 00:00:00,q,"Just bigger like a cinema hall, but worst quality."
103,10282,2016-04-16 00:00:00,q,And the video is also blurred to some extent.
103,10283,2016-04-16 00:00:00,q,"I tried cleaning the lenses, adjusting my phone's distance to the lenses etc.. but it was of no use."
103,10284,2016-04-16 00:00:00,q,"I tried different apps like VR player free, VR cinema and the native Google cardboard app."
103,10285,2016-04-16 00:00:00,q,I downloaded 360 degree videos from YouTube in 1080p resolution and used some normal 2D videos from my phone.
103,10286,2016-04-16 00:00:00,q,I use Lenovo K3 note which has 1920x1080 screen resolution.
103,10287,2016-04-16 00:00:00,q,The videos otherwise look good on the screen but sadly with cardboard they look bad :( I have tried different combinations of apps and video resolutions.
103,10288,2016-04-16 00:00:00,q,I noticed that the distance at which the apps render the video in front of your eye makes a significant difference to the experience.
103,10289,2016-04-16 00:00:00,q,The father the better.
103,10290,2016-04-16 00:00:00,q,The best I could do with this cardboard was to watch a few music videos in Google cardboard app.
103,10291,2016-04-16 00:00:00,q,360 videos in VR player were a let down as it was a very bad quality video experience overall.
103,10292,2016-04-16 00:00:00,q,IMHO 360 degree videos are experienced much better without the cardboard.
103,10293,2016-04-16 00:00:00,q,"To add to my troubles, the magnetic button does not work on my phone."
103,10294,2016-04-16 00:00:00,q,I had to remove the magnet assembly from the cardboard for viewing 360 degree videos.
103,10295,2016-04-16 00:00:00,q,Lenovo K3 note has a virtual gyroscope (Software based gyroscope). The magnet interferes with it somehow and it does not work with the magnet at all.
103,10296,2016-04-16 00:00:00,q,FYI: Lenovo K3 not does not fit in it.
103,10297,2016-04-16 00:00:00,q,It is bigger than the cardboard.
103,10298,2016-04-16 00:00:00,q,So some adjustment will be needed.
103,10299,2016-04-16 00:00:00,q, I wonder why so many people gave it a good rating on Amazon.. Either they had no clue what to expect or they just got excited to see their video on a big screen :P Your experience may vary based on your phone or the pair of lenses in your cardboard and other factors.
103,10300,2016-04-16 00:00:00,q,Maybe mine were not the best of the lot.
103,10301,2016-04-16 00:00:00,q,But this did not hurt much as I was prepared for it anyway.
103,10302,2016-04-16 00:00:00,q,;-)
10,10303,2016-05-13 00:00:00,q,I assume you are asking about career options for a person who is well versed with Google Analytics.
10,10304,2016-05-13 00:00:00,q,"If that is the case, I should say it’s not bad but not great."
10,10305,2016-05-13 00:00:00,q,"A lot of people work on Google Analytics but what differentiates a person is his ability to learn new web analytics tools, JavaScript programming and understanding things like omni channel and data management platforms."
13,10306,2016-05-21 00:00:00,q,Visit  Google Analytics Skill Salary - PayScale  and check the scope of Google Analytics in India.
99,10307,2016-09-28 00:00:00,q,"No sir, it's not Google that is marking India as a Nanak Haram country."
99,10308,2016-09-28 00:00:00,q,This is merely a troll by exploiting Google's search algorithm.
99,10309,2016-09-28 00:00:00,q, Namak Haram  was a very famous movie of Bollywood.
99,10310,2016-09-28 00:00:00,q,"When you search namak Haram country, you see the country in which the movie was made."
99,10311,2016-09-28 00:00:00,q,People have been trolling us over this (from our favourite neighbouring country) Here's an example.
99,10312,2016-09-28 00:00:00,q,If you google “Lord of the rings country” you get  UK.
99,10313,2016-09-28 00:00:00,q,Several articles by news websites have also been for the same.
99,10314,2016-09-28 00:00:00,q,"Hi I'm Apurva, I know stuff."
100,10315,2016-09-28 00:00:00,q,I can think of a few reasons.
100,10316,2016-09-28 00:00:00,q,Building a search engine that can compete with Google is not easy.
100,10317,2016-09-28 00:00:00,q,It takes a lot of resources.
100,10318,2016-09-28 00:00:00,q,A lot.
100,10319,2016-09-28 00:00:00,q,"You need a lot of servers for all the crawling, indexing, ranking, etc."
100,10320,2016-09-28 00:00:00,q,"Even if he came up with a search engine of his own, would you actually use it? Most people would just use Google anyway as it works well and is popular."
100,10321,2016-09-28 00:00:00,q,I'm pretty sure he doesn't know the roadmap to building and expanding a search engine.
100,10322,2016-09-28 00:00:00,q,He is the CEO but he was appointed fairly recently.
100,10323,2016-09-28 00:00:00,q,He is the CEO of Google.
100,10324,2016-09-28 00:00:00,q,"If that's not a satisfying and well paying job, I don't know what is."
100,10325,2016-09-28 00:00:00,q,These were just 4 reasons and I'm sure there are a lot more.
100,10326,2016-09-28 00:00:00,q,"Simply put, Google has pretty much captured the entire search engine market in India."
100,10327,2016-09-28 00:00:00,q,And building and operating a search engine of that magnitude is not even remotely easy.
100,10328,2016-09-28 00:00:00,q,"So unless someone comes up with a revolutionary new way to search for content on the Web, I don't think Google would be replaced."
100,10329,2016-09-28 00:00:00,q,"Even if someone did, I would be skeptical"
39,10330,2016-11-05 00:00:00,q,Join a consultant/body shopper in US and get in there first on an H1.
39,10331,2016-11-05 00:00:00,q,There are quite a few out there ready to make money by placing you at some local company once you reach there.
39,10332,2016-11-05 00:00:00,q,They take the risk of getting you out there and get paid by charging commissions while placing you at some local company on contract position.
39,10333,2016-11-05 00:00:00,q,Apply for MSFT/Google once you are on H1 out there.
39,10334,2016-11-05 00:00:00,q,H1 transfer is something MSFT/Google would readily do after they interview you multiple times over the phone and for a whole full day on campus face to face.
34,10335,2016-12-18 00:00:00,q,"You need visa like EB2A and relevant skills to get call! Let me give upfront information on the way you need to look for an intern job: Navigate to iimjobs website Target the section below: I would prefer IT Business Analyst would fit your studies mostly! Choose the below as 1–3 years experience or any relevant: Alternatively search for internship: Alternatively the best idea is to search the right internship in the below: If I am in your shoes, I just dont apply straight with my program classroom knowledge . Rather than that I would get industry knowledge such as Development or Test Automation and update CV to apply for such jobs which will help me with 100% internship conversion! For an example, Search with ‘Automation Test’ : Since this topic is hot cake in job market, if you update your CV, you get job offers as well! Once I read them and understood how these tools working for testing, I would write some basic scripts in particular comfortable programming language to me and get my CV updated as below: Search relevant profiles in Linkedin who are in automation: You will find few tools matching in their skills common across most of them."
34,10336,2016-12-18 00:00:00,q,"Find best way to learn those tools such as Selenium,BDD,Cucumber,TestNG through following steps: The best way to start your learning on automation tools is as follows: Try learning Java Programming using Java BLACK BOOK."
34,10337,2016-12-18 00:00:00,q,"If you find yourself comfortable in scripting functions,OOPs based logic,loops and other basic elements that is good enough! Move to learn Selenium WebDriver scripting using JAVA (using Software Automation Testing Secrets Revealed-Part1,2) Construct a framework by yourself and get it uploaded in GITHUB website Learn Jenkins on how to schedule the project Try GIT on how to add,commit,push and pull,re-base etc Once comfortable with Selenium, try Appium using Java Try using TestNG to run both Selenium and Appium based scripts Apply in Google or Facebook’s website for such profiles and  get the interview call from Google of Facebook ! Some books I referred here: Obviously as a final step, I will prepare ‘customised(which means update skills matching to the Job description related points within your profile) CV with Cover Letter’ for each intern (rather than using the same CV for all) and apply to them in respective website! Hope it is useful!. Don’t hesitate to take a print out of this information and paste in your college NOTICE BOARD-lets help fellow students to get benefited with good money on the internship opportunities! Click UPVOTE if it is useful"
51,10338,2017-01-04 00:00:00,q,"I think it works, but the supporting devices are very few."
51,10339,2017-01-04 00:00:00,q,See here Apple Home Kit supported devices.
51,10340,2017-01-04 00:00:00,q,Find accessories that work with Apple HomeKit
89,10341,2017-01-04 00:00:00,q,It is only for people currently studying at accredited institute as a student.
89,10342,2017-01-04 00:00:00,q,Sorry to say but you won’t be able to be a part of it.
63,10343,2017-01-12 00:00:00,q,Presently you can't.
63,10344,2017-01-12 00:00:00,q,Google isn't conducting any student ambassador program since 2014.
63,10345,2017-01-12 00:00:00,q,"Then, there was a portal -  http://gsa.withgoogle.com  where you could have applied for GSA between March - June."
63,10346,2017-01-12 00:00:00,q,"But, now it says application for GSA India is closed."
88,10347,2017-01-13 00:00:00,q,Recently I read a post on LinkedIn.
88,10348,2017-01-13 00:00:00,q,There was a guy who got an interview call from Google without even applying for it.
88,10349,2017-01-13 00:00:00,q,He went on to explain how he got it.
88,10350,2017-01-13 00:00:00,q,Though he didn't clear the interview.
88,10351,2017-01-13 00:00:00,q,He has worked in many startups for the past 3–4 years and developed a lot of technical skills and made the projects successful.
88,10352,2017-01-13 00:00:00,q,He has updated all the details in LinkedIn.
88,10353,2017-01-13 00:00:00,q,And he was directly contacted by the HR from Google.
88,10354,2017-01-13 00:00:00,q,"So, strengthen your technical skills."
88,10355,2017-01-13 00:00:00,q,"There are also courses in Udacity trained by Google employees, you will get opportunity to give interviews at Google if you do well."
88,10356,2017-01-13 00:00:00,q,All the best!
47,10357,2017-01-16 00:00:00,q,Apply through  Google.com/jobs . That's the only way.
47,10358,2017-01-16 00:00:00,q,"Unless you know someone well who works at Google, and can refer you for an open position."
49,10359,2017-01-18 00:00:00,q,"There are basically two type of site, one which have https and those who have http protocol Using HTTPS, the computers agree on a ""code"" between them, and then they scramble the messages using that ""code"" so that no one in between can read them."
49,10360,2017-01-18 00:00:00,q,This keeps your information safe from hackers.
49,10361,2017-01-18 00:00:00,q,"Now coming to the point, most of the web is today use https to secure your data but the once which don't use HTTP protocol."
49,10362,2017-01-18 00:00:00,q,These websites are called the unsecured as hackers can intercept your personal info and hence they are categorized as unsafe by Google Chrome
48,10363,2017-02-03 00:00:00,q,Namaste..! Working for Google is a kind of dream Job for most engg.
48,10364,2017-02-03 00:00:00,q,Graduates belonging to the CS or IT stream.
48,10365,2017-02-03 00:00:00,q,"There are a lot of departments{which just needs any degree} to work with like Google+ , Google maps e.t.c but these are third party jobs and you get to work for Google at their Office."
48,10366,2017-02-03 00:00:00,q,There are many instances where Google would absorb talented people working under the pay rolls of a third party into their payrolls with all the benefits.
48,10367,2017-02-03 00:00:00,q,I worked for Google Hyderabad under the payrolls of Randstad india limited.
48,10368,2017-02-03 00:00:00,q,Just visit the randstad india office and drop your resume.
48,10369,2017-02-03 00:00:00,q,"They will schedule an interview and a series of rounds that consist of multiple JAM sessions, a written test{these are conducted by the HR Dept."
